(57, 'other', 'high-school', 'engineer', 'blue', 'I am a university student,Università della Svizzera italiana,Looking forward to the Christmas Holidays,pass experimentation and evaluation course,move north,This is a sentence,eat lunch at mensa,180 ECTS,move south,tomorrow it is gonna be rainy,', 'iAmAUniversityStudent,universitàDellaSvizzeraItaliana,lookingForwardToTheChristmasHolidays,pass-experimentation-and-evaluation-course,move-north,this-is-a-sentence,eat-lunch-at-mensa,180-ECTS,moveSouth,tomorrowItIsGonnaBeRainy,', '33.301', '5885b732-afea-43db-9c86-1499781c46bb', '')
(43, 'male', 'high-school', 'engineer', '434334434334', '', '', '0', 'd3086a6f-8a3f-427a-aa49-a1ab0739328c', '')
(99, 'female', 'high-school', 'engineer', 'kelvin', '', '', '0', '515abd64-347d-4cd3-8ed8-76019547f50a', '')
(88, 'male', 'bachelors', 'engineer', 'likollari', 'move south,tomorrow it is gonna be rainy,I am a university student,180 ECTS,pass experimentation and evaluation course,This is a sentence,move north,Looking forward to the Christmas Holidays,Università della Svizzera italiana,eat lunch at mensa,', 'moverSound,tomorrowItIsGonnaBeRany,iAmUniversityStudent,180-ETCS,pass-experimentation-and-evaluation-curse,this-a-sentence,move-nprth,lookingForwardToTheChristmasHoliday,universitàDellaSvizzeraItaliana,eat-lunch-at-mensa,', '1.142, 0.621, 0.525, 0.464, 0.457, 0.469, 0.931, 0.451, 0.471, 0.939, ', '10f49626-bb70-4a7e-b18f-231366cadbef', 'False, False, False, False, False, False, False, False, True, True, ')
(33, 'male', 'high-school', 'student', 'ok', '180 ECTS,Looking forward to the Christmas Holidays,I am a university student,eat lunch at mensa,Università della Svizzera italiana,move north,tomorrow it is gonna be rainy,pass experimentation and evaluation course,move south,This is a sentence,', '180-ETCS,lookingForwardToTheChristmasHolidays,iAmAUniversityStudent,eat-lunch-at-mensa,universitàDellaSvizzeraItaliana,move-nprth,tomorrowItIsGonnaBeRaney,pass-experimentation-and-evaluation-coarse,moreSouth,this-is-a-sentence,', '2.859, 3.325, 3.726, 1.719, 0.909, 0.835, 1.424, 0.9, 0.871, 1.449, ', 'a63f1898-6a93-4667-af40-f09159ed319a', 'False, True, True, True, True, False, False, False, False, True, ')
(33, 'female', 'bachelors', 'engineer', 'openai', 'eat lunch at mensa,tomorrow it is gonna be rainy,move south,This is a sentence,180 ECTS,move north,Looking forward to the Christmas Holidays,Università della Svizzera italiana,pass experimentation and evaluation course,I am a university student,', 'eat-lunch-at-mensa,tomorrowItIsGonnaBeRainy,moveSouth,this-is-a-sentence,180-ECTS,move-north,lookingForwardToTheChristmasHolidays,universitàDellaSvizzeraItaliana,pass-experimentation-and-evaluation-course,iAmAUniversityStudent,', '1.812,1.269,1.018,3.415,1.721,1.318,1.728,1.164,4.61,5.715,', 'b6d66562-30f8-4c2c-bc70-3128bdddfe0a', '')
(18, 'female', 'high-school', 'engineer', '313131313131', 'eat lunch at mensa,move south,This is a sentence,Looking forward to the Christmas Holidays,I am a university student,move north,Università della Svizzera italiana,180 ECTS,tomorrow it is gonna be rainy,pass experimentation and evaluation course,', 'eat-lunch-at-mensa,moveSouth,this-is-a-sentence,lookingForwardToTheChristmasHolidays,iAmAUniversityStudent,move-north,universitàDellaSvizzeraItaliana,180-ECTS,tomorrowItIsGonnaBeRainy,pass-experimentation-and-evaluation-course,', '1.898, 1.717, 4.443, 1.248, 5.181, 1.808, 3.084, 2.106, 2.234, 2.127, ', 'b4ba2a84-9f5d-4ebe-b2d2-82a04ee2336c', '')
